{
  "period": {
    "start": "2099-04-08T00:00:00Z",
    "end": "2099-04-09T00:00:00Z"
  },
  "platform": "twitter",
  "topics": [
    {
      "topic": "minor meteor shower peaking before dawn tomorrow",
      "source_links": [
        "https://example.test/synthetic-trend/meteor-peak"
      ],
      "suggested_angles": [
        "no telescope needed: where to look and how long to let your eyes adjust",
        "why a wide dark patch of sky beats any eyepiece for meteors",
        "what to do with the scope instead while you wait for streaks"
      ]
    }
  ],
  "freshness_window": {
    "duration": "P1D",
    "expires_at": "2099-04-10T06:00:00Z"
  },
  "provenance": {
    "trust_zone": "U",
    "method": "adapter",
    "submitted_at": "2099-04-09T00:10:00Z"
  }
}
