{
  "period": {
    "start": "2099-04-07T00:00:00Z",
    "end": "2099-04-08T00:00:00Z"
  },
  "platform": "twitter",
  "topics": [
    {
      "topic": "clear-sky window over much of the northern hemisphere tonight",
      "source_links": [
        "https://example.test/synthetic-trend/clear-sky-window",
        "https://example.test/synthetic-trend/forecast-thread"
      ],
      "suggested_angles": [
        "what one object is worth pointing at first if you only get one clear hour",
        "the fastest way to focus the Moon before clouds return",
        "wide-and-bright-first framing: why low power finds more on a short window"
      ]
    },
    {
      "topic": "Jupiter well-placed in the evening sky this week",
      "source_links": [
        "https://example.test/synthetic-trend/jupiter-evening"
      ],
      "suggested_angles": [
        "how to tell Jupiter from a star with the naked eye (it doesn't twinkle)",
        "catching the four bright moons in a line at low power"
      ]
    }
  ],
  "freshness_window": {
    "duration": "PT18H",
    "expires_at": "2099-04-08T18:00:00Z"
  },
  "provenance": {
    "trust_zone": "U",
    "method": "manual",
    "submitted_by": "00000000000000001",
    "submitted_at": "2099-04-08T00:05:00Z"
  }
}
